{
  "$schema": "https://json-schema.org/draft/2020-12/schema",
  "title": "Executable Ticket",
  "type": "object",
  "additionalProperties": false,
  "required": ["schema_version", "project_id", "ticket_id", "status", "requirement_ids", "evidence_refs", "user_outcome", "scope", "non_scope", "inputs", "outputs", "dependencies", "shared_contracts", "owned_files", "shared_files", "acceptance_checks", "required_capabilities", "risk_class", "rollback", "owner_role", "build_receipt"],
  "$defs": {
    "check_result": {
      "type": "object",
      "additionalProperties": false,
      "required": ["check_id", "status", "build_identity", "evaluator_role", "evaluator_id", "evidence_ref", "evidence_sha256"],
      "properties": {
        "check_id": {"type": "string", "minLength": 1},
        "status": {"enum": ["PASS", "FAIL", "BLOCKED"]},
        "build_identity": {"type": "string", "minLength": 1},
        "evaluator_role": {"const": "assurance"},
        "evaluator_id": {"type": "string", "minLength": 1},
        "evidence_ref": {"type": "string", "minLength": 1},
        "evidence_sha256": {"type": "string", "pattern": "^[a-f0-9]{64}$"}
      }
    }
  },
  "properties": {
    "schema_version": {"const": 2},
    "project_id": {"type": "string"},
    "ticket_id": {"type": "string", "minLength": 1},
    "status": {"enum": ["DRAFT", "APPROVED", "IN_PROGRESS", "EVIDENCE_GREEN", "BLOCKED", "SUPERSEDED"]},
    "requirement_ids": {"type": "array", "minItems": 1, "uniqueItems": true, "items": {"type": "string"}},
    "evidence_refs": {"type": "array", "minItems": 1, "items": {"type": "string"}},
    "user_outcome": {"type": "string"},
    "scope": {"type": "array", "minItems": 1, "items": {"type": "string"}},
    "non_scope": {"type": "array", "items": {"type": "string"}},
    "inputs": {"type": "array", "items": {"type": "string"}},
    "outputs": {"type": "array", "minItems": 1, "items": {"type": "string"}},
    "dependencies": {"type": "array", "uniqueItems": true, "items": {"type": "string"}},
    "shared_contracts": {"type": "array", "items": {"type": "string"}},
    "owned_files": {"type": "array", "uniqueItems": true, "items": {"type": "string"}},
    "shared_files": {"type": "array", "uniqueItems": true, "items": {"type": "string"}},
    "acceptance_checks": {
      "type": "array", "minItems": 1,
      "items": {
        "type": "object", "additionalProperties": false,
        "required": ["id", "type", "check", "expected", "evidence"],
        "properties": {
          "id": {"type": "string", "minLength": 1},
          "type": {"enum": ["deterministic", "live", "experiential", "human_gate"]},
          "check": {"type": "string"}, "expected": {"type": "string"},
          "evidence": {"type": ["string", "null"]}
        }
      }
    },
    "required_capabilities": {"type": "array", "uniqueItems": true, "items": {"type": "string"}},
    "risk_class": {"enum": ["low", "medium", "high", "critical"]},
    "rollback": {"type": "string", "minLength": 1},
    "owner_role": {"const": "implementation-engineer"},
    "build_receipt": {
      "type": ["object", "null"],
      "properties": {
        "build_identity": {"type": "string", "minLength": 1},
        "changed_files": {"type": "array", "items": {"type": "string"}},
        "check_results": {"type": "array", "minItems": 1, "items": {"$ref": "#/$defs/check_result"}},
        "completed_at": {"type": "string", "format": "date-time"}
      },
      "required": ["build_identity", "changed_files", "check_results", "completed_at"],
      "additionalProperties": false
    }
  },
  "allOf": [{
    "if": {"properties": {"status": {"const": "EVIDENCE_GREEN"}}},
    "then": {"properties": {
      "build_receipt": {"type": "object", "properties": {"check_results": {"items": {"properties": {"status": {"const": "PASS"}}}}}},
      "acceptance_checks": {"items": {"properties": {"evidence": {"type": "string", "minLength": 1}}}}
    }}
  }]
}
